<?xml version="1.0" encoding="UTF-8"?>
<?xml-stylesheet type="text/xsl" href="estilo-equipo.xsl"?>
<equipo nombre="FCBARCELONA" escudo="../img/FCBarcelona.png" xmlns:xsi="http://www.w3.org/2001/XMLSchema-instance" xsi:noNamespaceSchemaLocation="validacion-equipo.xsd">

    <componente tipo="entrenador">
        <imagen>e2.png</imagen>
        <nombre>Alicia </nombre>
        <apellidos>Montjuic</apellidos>
        <posicion>null</posicion>
    </componente>

    <componente tipo="jugador">
        <imagen>j10.png</imagen>
        <nombre>Merche </nombre>
        <apellidos>Castellano</apellidos>
        <posicion>Portera</posicion>
    </componente>

    <componente tipo="jugador">
        <imagen>j11.png</imagen>
        <nombre>Sandra</nombre>
        <apellidos>Paños</apellidos>
        <posicion>Lateral Izquierdo</posicion>
    </componente>

    <componente tipo="jugador">
        <imagen>j12.png</imagen>
        <nombre>Lucy </nombre>
        <apellidos>Bronze</apellidos>
        <posicion>Lateral Derecho</posicion>
    </componente>

    <componente tipo="jugador">
        <imagen>j13.png</imagen>
        <nombre>Marta </nombre>
        <apellidos>Torrejón</apellidos>
        <posicion>Extremo Izquierda</posicion>

    </componente>

    <componente tipo="jugador">
        <imagen>j14.png</imagen>
        <nombre>Olga </nombre>
        <apellidos>García</apellidos>
        <posicion>Extremo Derecha</posicion>
    </componente>

    <componente tipo="jugador">
        <imagen>j15.png</imagen>
        <nombre>Mapi</nombre>
        <apellidos>León </apellidos>
        <posicion>Pivote</posicion>
    </componente>

    <componente tipo="jugador">
        <imagen>j16.png</imagen>
        <nombre>Alexia </nombre>
        <apellidos>Putellas </apellidos>
        <posicion>Central</posicion>
    </componente>

    <componente tipo="jugador">
        <imagen>j17.png</imagen>
        <nombre>María  </nombre>
        <apellidos>García </apellidos>
        <posicion>Central</posicion>
    </componente>

    <componente tipo="jugador">
        <imagen>j18.png</imagen>
        <nombre>Laura </nombre>
        <apellidos>Rodríguez </apellidos>
        <posicion>Extremo derecha</posicion>
    </componente>
    
</equipo>