<?xml version="1.0" encoding="UTF-8"?>
<?xml-stylesheet type="text/xsl" href="estilo-equipo.xsl"?>
<equipo nombre="REAL MADRID" escudo="../img/Real Madrid.png" xmlns:xsi="http://www.w3.org/2001/XMLSchema-instance" xsi:noNamespaceSchemaLocation="validacion-equipo.xsd">

    <componente tipo="entrenador">
        <imagen>e3.png</imagen>
        <nombre>Beñat </nombre>
        <apellidos>Arnaiz </apellidos>
        <posicion>null</posicion>
    </componente>

    <componente tipo="jugador">
        <imagen>j19.png</imagen>
        <nombre>Alba </nombre>
        <apellidos>Sánchez </apellidos>
        <posicion>Portera</posicion>
    </componente>

    <componente tipo="jugador">
        <imagen>j20.png</imagen>
        <nombre>Ane </nombre>
        <apellidos>Encina</apellidos>
        <posicion>Lateral Izquierdo</posicion>
    </componente>

    <componente tipo="jugador">
        <imagen>j21.png</imagen>
        <nombre>Estitxu </nombre>
        <apellidos>Berasategi</apellidos>
        <posicion>Lateral Derecho</posicion>
    </componente>

    <componente tipo="jugador">
        <imagen>j22.png</imagen>
        <nombre>Paula </nombre>
        <apellidos>García </apellidos>
        <posicion>Extremo Izquierda</posicion>
    </componente>

    <componente tipo="jugador">
        <imagen>j23.png</imagen>
        <nombre>Ana </nombre>
        <apellidos>Arozamena </apellidos>
        <posicion>Extremo Derecha</posicion>
    </componente>

    <componente tipo="jugador">
        <imagen>j24.png</imagen>
        <nombre>Maddi </nombre>
        <apellidos>Bengoetxea </apellidos>
        <posicion>Pivote</posicion>
    </componente>
    <componente tipo="jugador">
        <imagen>j25.png</imagen>
        <nombre>Silvia </nombre>
        <apellidos>Arderíus </apellidos>
        <posicion>Central</posicion>
    </componente>
    <componente tipo="jugador">
        <imagen>j26.png</imagen>
        <nombre>Beatriz  </nombre>
        <apellidos>Jiménez </apellidos>
        <posicion>Portera</posicion>
    </componente>
    <componente tipo="jugador">
        <imagen>j27.png</imagen>
        <nombre>Vanessa  </nombre>
        <apellidos>Torres </apellidos>
        <posicion>Lateral derecho</posicion>
    </componente>
    
</equipo>