<?xml version="1.0" encoding="UTF-8"?>
<?xml-stylesheet type="text/xsl" href="estilo-equipo.xsl"?>
<equipo nombre="ZARAGOZA" escudo="../img/Real Zaragoza.png" xmlns:xsi="http://www.w3.org/2001/XMLSchema-instance" xsi:noNamespaceSchemaLocation="validacion-equipo.xsd">

    <componente tipo="entrenador">
        <imagen>e4.png</imagen>
        <nombre>Claudio </nombre>
        <apellidos>Ramos </apellidos>
        <posicion>null</posicion>
    </componente>

    <componente tipo="jugador">
        <imagen>j46.png</imagen>
        <nombre>Raquel </nombre>
        <apellidos>Caño </apellidos>
        <posicion>Portera</posicion>
    </componente>

    <componente tipo="jugador">
        <imagen>j47.png</imagen>
        <nombre>Mireya  </nombre>
        <apellidos>Gónzalez </apellidos>
        <posicion>Lateral Izquierdo</posicion>
    </componente>

    <componente tipo="jugador">
        <imagen>j48.png</imagen>
        <nombre>Deonise  </nombre>
        <apellidos>Fachinello   </apellidos>
        <posicion>Lateral Derecho</posicion>
    </componente>

    <componente tipo="jugador">
        <imagen>j49.png</imagen>
        <nombre>Soraya  </nombre>
        <apellidos>García  </apellidos>
        <posicion>Extremo Izquierda</posicion>
    </componente>

    <componente tipo="jugador">
        <imagen>j50.png</imagen>
        <nombre>Anna </nombre>
        <apellidos>Gonzales</apellidos>
        <posicion>Extremo Derecha</posicion>
    </componente>

    <componente tipo="jugador">
        <imagen>j51.png</imagen>
        <nombre>Ona  </nombre>
        <apellidos>Vegue  </apellidos>
        <posicion>Pivote</posicion>
    </componente>

    <componente tipo="jugador">
        <imagen>j52.png</imagen>
        <nombre>María  </nombre>
        <apellidos>Prieto  </apellidos>
        <posicion>Central</posicion>
    </componente>
    <componente tipo="jugador">
        <imagen>j53.png</imagen>
        <nombre>Ana   </nombre>
        <apellidos>López  </apellidos>
        <posicion>Portera</posicion>
    </componente>
    <componente tipo="jugador">
        <imagen>j54.png</imagen>
        <nombre>Patricia   </nombre>
        <apellidos>Martínez  </apellidos>
        <posicion>Lateral izquierdo</posicion>
    </componente>
    
</equipo>